{
  "$schema": "urn:watchtower:schema:interfaces:packs:pack-runtime-manifest:v1",
  "surface_name": "pack_runtime_manifest",
  "contract_version": "v1",
  "description": "Fixture runtime manifest for the plan validation pack.",
  "updated_at": "2026-03-21T21:05:00Z",
  "pack_id": "pack.plan",
  "pack_slug": "plan",
  "command_namespace": "plan",
  "python_distribution": "watchtower-plan",
  "python_package": "watchtower_plan",
  "integration_module": "watchtower_plan.integration",
  "declared_capabilities": [
    "command_registration",
    "query_runtime",
    "sync_targets",
    "validation_provider"
  ],
  "required_validation_suite_ids": [
    "suite.plan.validation_baseline"
  ],
  "owned_roots": {
    "workspace_root": "packs/plan",
    "machine_root": "packs/plan/.wt",
    "docs_root": "packs/plan/docs",
    "workflows_root": "packs/plan/workflows",
    "tracking_root": "packs/plan/tracking",
    "python_root": "packs/plan/python",
    "initiatives_root": "packs/plan/initiatives",
    "projects_root": "packs/plan/projects",
    "domain_roots": {
      "initiatives": "packs/plan/initiatives",
      "projects": "packs/plan/projects"
    }
  }
}
